[
  {
    "pattern_id": "head_and_shoulders",
    "category": "chart_pattern",
    "display_name": "Head and Shoulders",
    "aliases": [
      "H&S",
      "head-and-shoulders"
    ],
    "description": "Classic reversal setup made of three swing highs: a peak, a higher head, and a lower right shoulder that stalls near the height of the left shoulder. A neckline connecting the swing lows acts as the confirmation level—once broken, momentum is expected to rotate lower as trapped buyers exit.",
    "recognition_rules": {
      "candle_structure": "Left shoulder advances then pulls back, head prints a higher high, and the right shoulder tops out below the head while volume fades.",
      "trend_context": "Works best after a sustained uptrend or parabolic push where distribution forms along a horizontal neckline.",
      "volume_confirmation": "Look for declining volume across the right shoulder and an expansion on the neckline breakdown.",
      "invalidations": [
        "Close back above the right-shoulder swing high after the neckline break",
        "Neckline slopes sharply higher without consolidation"
      ]
    },
    "trading_playbook": {
      "signal": "bearish",
      "entry": "Trigger on a decisive close below the neckline or on a throwback rejection when price retests the neckline from beneath.",
      "stop_loss": "Defensive stop above the right-shoulder swing high; conservative traders can park above the head.",
      "targets": [
        "Measure the vertical distance from head to neckline and project downward from the breakout point",
        "Trail into prior demand zones or round-number magnets"
      ],
      "risk_notes": "Choppy ranges dull the edge—prefer clean symmetry between shoulders and a neckline with multiple touches.",
      "timeframe_bias": "swing"
    },
    "statistics": {
      "typical_duration": "Several weeks on daily charts; shorter on intraday timeframes"
    },
    "visual_examples": [
      {
        "source": "Cup_and_Handle.gif",
        "page": null
      }
    ],
    "sources": [
      {
        "doc": "Price-Action-Patterns.pdf",
        "page": 4
      }
    ]
  },
  {
    "pattern_id": "cup_and_handle",
    "category": "chart_pattern",
    "display_name": "Cup and Handle",
    "aliases": [
      "cup & handle"
    ],
    "description": "Bullish continuation pattern where price rounds out a U-shaped basing phase (the cup) followed by a shallow pullback or consolidation (the handle). A break above handle resistance implies trend resumption with trapped shorts forced to cover.",
    "recognition_rules": {
      "candle_structure": "Cup forms with a smooth rounded bottom; handle drifts lower or sideways no more than one-third of the cup depth.",
      "trend_context": "Preferably emerges after a strong uptrend that pauses for reaccumulation before the next leg higher.",
      "volume_confirmation": "Volume dries up near the cup bottom and handle, then expands on the breakout thrust.",
      "invalidations": [
        "Handle retraces more than 50% of the cup advance",
        "Breakdown below the cup lows before the breakout"
      ]
    },
    "trading_playbook": {
      "signal": "bullish",
      "entry": "Buy the breakout through handle resistance or on a secondary retest that holds above former resistance.",
      "stop_loss": "Place beneath handle lows or, for longer-term structures, under the midpoint of the cup.",
      "targets": [
        "Project the cup depth from the breakout level",
        "Use measured moves into prior swing highs or Fibonacci extensions"
      ],
      "risk_notes": "Avoid when the handle is extremely steep or volume spikes ahead of the breakout (signs of distribution).",
      "timeframe_bias": "medium-term"
    },
    "statistics": {
      "typical_duration": "1–6 months on daily charts"
    },
    "visual_examples": [
      {
        "source": "Cup_and_Handle.gif",
        "page": null
      }
    ],
    "sources": [
      {
        "doc": "Encyclopedia of Chart Patterns.pdf",
        "page": 120
      }
    ]
  },
  {
    "pattern_id": "bullish_engulfing",
    "category": "candlestick",
    "display_name": "Bullish Engulfing",
    "aliases": [
      "bullish engulfing candle"
    ],
    "description": "Two-candle reversal where a wide real body completely engulfs the prior down candle, signaling an aggressive shift from sellers to buyers. Often marks exhaustion lows or the first step of a swing reversal.",
    "recognition_rules": {
      "candle_structure": "First candle closes lower with a relatively small real body; second candle opens below (or near) the prior close and pushes above the prior open, engulfing the full body.",
      "trend_context": "Most reliable after a down swing into support or near the tail end of a bearish impulse.",
      "volume_confirmation": "Rising volume or increased tick activity on the engulfing bar strengthens the signal.",
      "invalidations": [
        "Close back below the engulfing bar’s midpoint within the next one to two candles",
        "Pattern forms inside congested chop without downward momentum"
      ]
    },
    "trading_playbook": {
      "signal": "bullish",
      "entry": "Enter on the close of the engulfing bar or on a modest retracement into its midpoint.",
      "stop_loss": "Place below the engulfing candle’s low to respect the invalidation threshold.",
      "targets": [
        "Target nearby supply zones or the next pivot high",
        "Trail behind higher swing lows if momentum builds"
      ],
      "risk_notes": "Lower reliability when the engulfing candle emerges at resistance or within strong macro downtrends.",
      "timeframe_bias": "short-term"
    },
    "statistics": {
      "typical_duration": "1–5 bars for initial follow-through"
    },
    "visual_examples": [
      {
        "source": "IMAGE 2023-12-09 12:53:20.jpg",
        "page": null
      }
    ],
    "sources": [
      {
        "doc": "technical_analysis_for_dummies_2nd_edition.pdf",
        "page": 210
      }
    ]
  },
  {
    "pattern_id": "ascending_triangle",
    "category": "chart_pattern",
    "display_name": "Ascending Triangle",
    "aliases": ["asc triangle"],
    "description": "Bullish continuation pattern with horizontal resistance and rising support trendline. Buyers become increasingly aggressive while sellers hold a consistent level.",
    "recognition_rules": {
      "candle_structure": "Multiple swing highs cluster near the same horizontal level; swing lows form a rising trendline.",
      "trend_context": "Best after an uptrend where bulls pause to consolidate before next leg.",
      "volume_confirmation": "Volume contracts during consolidation, expands sharply on breakout.",
      "invalidations": [
        "Breakdown below rising support trendline",
        "Multiple failed breakout attempts with declining volume"
      ]
    },
    "trading_playbook": {
      "signal": "bullish",
      "entry": "Enter on decisive close above horizontal resistance or on retest pullback.",
      "stop_loss": "Below most recent swing low or below rising trendline.",
      "targets": [
        "Project triangle height from breakout point",
        "Target prior swing highs or measured moves"
      ],
      "risk_notes": "False breakouts common at resistance - watch for volume confirmation.",
      "timeframe_bias": "medium-term"
    },
    "statistics": {
      "typical_duration": "2-6 weeks on daily charts"
    },
    "visual_examples": [],
    "sources": []
  },
  {
    "pattern_id": "descending_triangle",
    "category": "chart_pattern",
    "display_name": "Descending Triangle",
    "aliases": ["desc triangle"],
    "description": "Bearish continuation pattern with horizontal support and descending resistance trendline. Sellers become increasingly aggressive while buyers hold a consistent level.",
    "recognition_rules": {
      "candle_structure": "Multiple swing lows cluster near the same horizontal level; swing highs form a descending trendline.",
      "trend_context": "Best after a downtrend where bears pause to consolidate before next leg.",
      "volume_confirmation": "Volume contracts during consolidation, expands sharply on breakdown.",
      "invalidations": [
        "Breakout above descending resistance trendline",
        "Multiple failed breakdown attempts with declining volume"
      ]
    },
    "trading_playbook": {
      "signal": "bearish",
      "entry": "Enter on decisive close below horizontal support or on retest bounce.",
      "stop_loss": "Above most recent swing high or above descending trendline.",
      "targets": [
        "Project triangle height from breakdown point",
        "Target prior swing lows or measured moves"
      ],
      "risk_notes": "False breakdowns common at support - watch for volume confirmation.",
      "timeframe_bias": "medium-term"
    },
    "statistics": {
      "typical_duration": "2-6 weeks on daily charts"
    },
    "visual_examples": [],
    "sources": []
  },
  {
    "pattern_id": "symmetrical_triangle",
    "category": "chart_pattern",
    "display_name": "Symmetrical Triangle",
    "aliases": ["sym triangle", "coil"],
    "description": "Neutral continuation pattern with converging trendlines. Breakout direction usually follows prior trend.",
    "recognition_rules": {
      "candle_structure": "Swing highs form descending trendline; swing lows form ascending trendline creating apex.",
      "trend_context": "Can appear in any trend; breakout typically continues prior direction.",
      "volume_confirmation": "Volume declines as triangle narrows, expands on breakout.",
      "invalidations": [
        "Price reaches apex without breaking out (indecision)",
        "Weak breakout with no volume follow-through"
      ]
    },
    "trading_playbook": {
      "signal": "neutral",
      "entry": "Wait for breakout direction, enter on decisive close beyond trendline.",